{"dataset":"rpc-health","api_version":"v1","schema_version":"1.1.0","schema_url":"https://blockchains.github.io/blockchainlab-api/v1/schemas/rpc-health.schema.json","description":"Health of popular free public RPC endpoints (EVM chains, Solana, Bitcoin): reachability, latency, block lag vs best endpoint, chain-ID check. Probed from a GitHub Actions runner (US) at build time.","generated_at":"2026-10-30T10:04:55.857Z","source":"Blockchain Lab probe (GitHub Actions)","source_url":"https://github.com/Blockchains/blockchainlab-api/blob/main/scripts/build.mjs","built_by":"Blockchain Lab — https://blockchainlab.com","licence_note":"Data belongs to the named source; check its terms before reuse. Attribute the source and Blockchain Lab.","count":34,"healthy":25,"data":[{"chain":"ethereum","chain_id":1,"url":"https://ethereum-rpc.publicnode.com","ok":true,"latency_ms":159,"block":26304858,"chain_id_ok":true,"lag_blocks":0,"healthy":true,"checked_at":"2026-10-30T10:04:55.857Z"},{"chain":"ethereum","chain_id":1,"url":"https://eth.llamarpc.com","ok":false,"error":"Unexpected token '<', \"<!DOCTYPE \"... is not valid JSON","healthy":false,"checked_at":"2026-10-30T10:04:55.857Z"},{"chain":"ethereum","chain_id":1,"url":"https://rpc.ankr.com/eth","ok":false,"error":"Unauthorized: You must authenticate your request with an API key. Create an account on https://www.ankr.com/rpc/ and generate your personal ","healthy":false,"checked_at":"2026-10-30T10:04:55.857Z"},{"chain":"ethereum","chain_id":1,"url":"https://1rpc.io/eth","ok":true,"latency_ms":136,"block":26304857,"chain_id_ok":true,"lag_blocks":1,"healthy":true,"checked_at":"2026-10-30T10:04:55.857Z"},{"chain":"ethereum","chain_id":1,"url":"https://eth.drpc.org","ok":true,"latency_ms":50,"block":26304858,"chain_id_ok":true,"lag_blocks":0,"healthy":true,"checked_at":"2026-10-30T10:04:55.857Z"},{"chain":"ethereum","chain_id":1,"url":"https://cloudflare-eth.com","ok":false,"error":"Cannot fulfill request","healthy":false,"checked_at":"2026-10-30T10:04:55.857Z"},{"chain":"base","chain_id":8453,"url":"https://base-rpc.publicnode.com","ok":true,"latency_ms":98,"block":53282684,"chain_id_ok":true,"lag_blocks":0,"healthy":true,"checked_at":"2026-10-30T10:04:55.857Z"},{"chain":"base","chain_id":8453,"url":"https://mainnet.base.org","ok":true,"latency_ms":83,"block":53282684,"chain_id_ok":true,"lag_blocks":0,"healthy":true,"checked_at":"2026-10-30T10:04:55.857Z"},{"chain":"base","chain_id":8453,"url":"https://base.llamarpc.com","ok":false,"error":"Unexpected token '<', \"<!DOCTYPE \"... is not valid JSON","healthy":false,"checked_at":"2026-10-30T10:04:55.857Z"},{"chain":"base","chain_id":8453,"url":"https://1rpc.io/base","ok":true,"latency_ms":56,"block":53282684,"chain_id_ok":true,"lag_blocks":0,"healthy":true,"checked_at":"2026-10-30T10:04:55.857Z"},{"chain":"base","chain_id":8453,"url":"https://base.drpc.org","ok":true,"latency_ms":45,"block":53282684,"chain_id_ok":true,"lag_blocks":0,"healthy":true,"checked_at":"2026-10-30T10:04:55.857Z"},{"chain":"arbitrum","chain_id":42161,"url":"https://arbitrum-one-rpc.publicnode.com","ok":true,"latency_ms":96,"block":519645047,"chain_id_ok":true,"lag_blocks":11,"healthy":false,"checked_at":"2026-10-30T10:04:55.857Z"},{"chain":"arbitrum","chain_id":42161,"url":"https://arb1.arbitrum.io/rpc","ok":true,"latency_ms":72,"block":519645043,"chain_id_ok":true,"lag_blocks":15,"healthy":false,"checked_at":"2026-10-30T10:04:55.857Z"},{"chain":"arbitrum","chain_id":42161,"url":"https://1rpc.io/arb","ok":true,"latency_ms":4343,"block":519645058,"chain_id_ok":true,"lag_blocks":0,"healthy":true,"checked_at":"2026-10-30T10:04:55.857Z"},{"chain":"arbitrum","chain_id":42161,"url":"https://arbitrum.drpc.org","ok":true,"latency_ms":45,"block":519645046,"chain_id_ok":true,"lag_blocks":12,"healthy":false,"checked_at":"2026-10-30T10:04:55.857Z"},{"chain":"optimism","chain_id":10,"url":"https://optimism-rpc.publicnode.com","ok":true,"latency_ms":93,"block":158877973,"chain_id_ok":true,"lag_blocks":1,"healthy":true,"checked_at":"2026-10-30T10:04:55.857Z"},{"chain":"optimism","chain_id":10,"url":"https://mainnet.optimism.io","ok":true,"latency_ms":222,"block":158877974,"chain_id_ok":true,"lag_blocks":0,"healthy":true,"checked_at":"2026-10-30T10:04:55.857Z"},{"chain":"optimism","chain_id":10,"url":"https://1rpc.io/op","ok":true,"latency_ms":100,"block":158877974,"chain_id_ok":true,"lag_blocks":0,"healthy":true,"checked_at":"2026-10-30T10:04:55.857Z"},{"chain":"optimism","chain_id":10,"url":"https://optimism.drpc.org","ok":true,"latency_ms":49,"block":158877973,"chain_id_ok":true,"lag_blocks":1,"healthy":true,"checked_at":"2026-10-30T10:04:55.857Z"},{"chain":"polygon","chain_id":137,"url":"https://polygon-bor-rpc.publicnode.com","ok":true,"latency_ms":95,"block":96432847,"chain_id_ok":true,"lag_blocks":0,"healthy":true,"checked_at":"2026-10-30T10:04:55.857Z"},{"chain":"polygon","chain_id":137,"url":"https://polygon-rpc.com","ok":false,"error":"no result","healthy":false,"checked_at":"2026-10-30T10:04:55.857Z"},{"chain":"polygon","chain_id":137,"url":"https://1rpc.io/matic","ok":true,"latency_ms":2115,"block":96432847,"chain_id_ok":true,"lag_blocks":0,"healthy":true,"checked_at":"2026-10-30T10:04:55.857Z"},{"chain":"polygon","chain_id":137,"url":"https://polygon.drpc.org","ok":true,"latency_ms":41,"block":96432847,"chain_id_ok":true,"lag_blocks":0,"healthy":true,"checked_at":"2026-10-30T10:04:55.857Z"},{"chain":"bsc","chain_id":56,"url":"https://bsc-rpc.publicnode.com","ok":true,"latency_ms":131,"block":130646055,"chain_id_ok":true,"lag_blocks":0,"healthy":true,"checked_at":"2026-10-30T10:04:55.857Z"},{"chain":"bsc","chain_id":56,"url":"https://bsc-dataseed.bnbchain.org","ok":true,"latency_ms":37,"block":130646055,"chain_id_ok":true,"lag_blocks":0,"healthy":true,"checked_at":"2026-10-30T10:04:55.857Z"},{"chain":"bsc","chain_id":56,"url":"https://1rpc.io/bnb","ok":true,"latency_ms":134,"block":130646043,"chain_id_ok":true,"lag_blocks":12,"healthy":false,"checked_at":"2026-10-30T10:04:55.857Z"},{"chain":"bsc","chain_id":56,"url":"https://bsc.drpc.org","ok":true,"latency_ms":49,"block":130646055,"chain_id_ok":true,"lag_blocks":0,"healthy":true,"checked_at":"2026-10-30T10:04:55.857Z"},{"chain":"avalanche","chain_id":43114,"url":"https://avalanche-c-chain-rpc.publicnode.com","ok":true,"latency_ms":90,"block":98945351,"chain_id_ok":true,"lag_blocks":2,"healthy":true,"checked_at":"2026-10-30T10:04:55.857Z"},{"chain":"avalanche","chain_id":43114,"url":"https://api.avax.network/ext/bc/C/rpc","ok":true,"latency_ms":109,"block":98945350,"chain_id_ok":true,"lag_blocks":3,"healthy":true,"checked_at":"2026-10-30T10:04:55.857Z"},{"chain":"avalanche","chain_id":43114,"url":"https://1rpc.io/avax/c","ok":true,"latency_ms":1894,"block":98945353,"chain_id_ok":true,"lag_blocks":0,"healthy":true,"checked_at":"2026-10-30T10:04:55.857Z"},{"chain":"avalanche","chain_id":43114,"url":"https://avalanche.drpc.org","ok":true,"latency_ms":47,"block":98945351,"chain_id_ok":true,"lag_blocks":2,"healthy":true,"checked_at":"2026-10-30T10:04:55.857Z"},{"chain":"solana","url":"https://solana-rpc.publicnode.com","ok":true,"latency_ms":110,"block":463245025,"healthy":true,"checked_at":"2026-10-30T10:04:55.857Z"},{"chain":"solana","url":"https://api.mainnet-beta.solana.com","ok":true,"latency_ms":169,"block":463245025,"healthy":true,"checked_at":"2026-10-30T10:04:55.857Z"},{"chain":"bitcoin","url":"https://bitcoin-rpc.publicnode.com","ok":true,"latency_ms":134,"block":973803,"healthy":true,"checked_at":"2026-10-30T10:04:55.857Z"}]}